{
  "@context": "https://schema.org",
  "@type": "ItemList",
  "name": "Law Types",
  "description": "Categories for classifying data-related laws",
  "itemListElement": [
    {
      "identifier": "privacy",
      "name": "Privacy Laws",
      "shortName": "Privacy",
      "description": "Laws that protect individual data rights and privacy",
      "emoji": "üõ°Ô∏è",
      "badgeClass": "badge-success"
    },
    {
      "identifier": "access",
      "name": "Access Laws",
      "shortName": "Access",
      "description": "Laws that enable government or law enforcement data access",
      "emoji": "üîì",
      "badgeClass": "badge-warning"
    },
    {
      "identifier": "surveillance",
      "name": "Surveillance Laws",
      "shortName": "Surveillance",
      "description": "Laws that establish surveillance infrastructure or powers",
      "emoji": "üëÅÔ∏è",
      "badgeClass": "badge-error"
    },
    {
      "identifier": "localization",
      "name": "Localization Laws",
      "shortName": "Localization",
      "description": "Laws that require data to be stored within jurisdiction",
      "emoji": "üìç",
      "badgeClass": "badge-info"
    },
    {
      "identifier": "security",
      "name": "Security Laws",
      "shortName": "Security",
      "description": "National security frameworks",
      "emoji": "üîí",
      "badgeClass": "badge-secondary"
    },
    {
      "identifier": "sector",
      "name": "Sector-Specific Laws",
      "shortName": "Sector",
      "description": "Laws regulating specific sectors (AI, telecom, finance, etc.)",
      "emoji": "üìã",
      "badgeClass": "badge-ghost"
    }
  ]
}
